{"budget":{"final_sha256":"ff363e8072775acfbf43b3eb0ea2b16f7e4eb6da12b2f52fc8e4820cbbc85c9f","initial_sha256":"ff363e8072775acfbf43b3eb0ea2b16f7e4eb6da12b2f52fc8e4820cbbc85c9f","outcome":"completed"},"certificate_id":"certificate_invalid_certificate","checker":{"component_id":"component_checker","configuration_sha256":"f1d75d2d54572a4ea6ef7d0a3c44e16db3c48468319bc9ff689f9fcb27de1e66","contract_id":"MH-C-EXAMPLE-CHECKER-001","contract_sha256":"0995c19b67f7c09c267750fcfce7cfcde433676f646c414eb627e7c5f79d258c","environment_contract_sha256":"9a7b3269c4fbf66d12a5df2afd09d362d0746fcde26391c917c8cd172ca32506","implementation_sha256":"4b7905c1cfb775739c32cadda25f367ab9188230e1c14d7d501e03b3b217c591","name":"org.mathhead.example-checker","role":"checker","version":"1.0.0"},"diagnostics":[{"code":"org.mathhead.fixture.invalid-certificate","details":{},"diagnostic_id":"diagnostic_certificate","message":"certificate did not establish a verified claim","related_artifact_ids":["artifact_checker_result"],"severity":"warning"}],"evidence":{"dependency_sha256s":[],"evidence_id":"evidence_invalid_certificate","evidence_sha256":"fc29c96c02ddb719a7b370b179a8956f503c47f0eb971d19bc60ae48dda3cae7","format_features":[],"format_id":"org.mathhead.proof","format_version":"1.0.0","primary_payload_sha256":"03c255b4d39290e8abbfde862613c206ceb1696e6836c3844728efe3d2d67b9e","producer":{"component_id":"component_producer","configuration_sha256":"840e05350e0048be566b23028d81590605b88f70844e3e4a428b42d798ac3de8","contract_sha256":"05c4ce74dff8cd9af76d64a936f91450026266cedfaaedb44e8f2b5d98569141","implementation_sha256":"2664ea2ad38cb0501499c85eb6be26069aa09b7835e62a50a4f7b4fb24726f47","role":"solver"},"schema":"mathhead.evidence.v1"},"extensions":{},"format":{"canonicalization":"org.mathhead.canonical-json","features":[],"format_id":"org.mathhead.certificate","major":1,"minor":0,"reader_minimum_minor":0,"schema_sha256":"d711d069d977490a0e85486205b615a49870da271061914a058b9a6d18d0a83b","version":"1.0.0"},"replay":{"algorithm_id":"org.mathhead.fixture.check.invalid-certificate","attempt_id":"attempt_invalid_certificate","basis_sha256":"1a826464ef42513122dfd68435347f1c266bf6e6c00b1057429c4b5a6f60d94a","configuration_sha256":"f1d75d2d54572a4ea6ef7d0a3c44e16db3c48468319bc9ff689f9fcb27de1e66","expected_payload_sha256":"03c255b4d39290e8abbfde862613c206ceb1696e6836c3844728efe3d2d67b9e","input_evidence_sha256":"fc29c96c02ddb719a7b370b179a8956f503c47f0eb971d19bc60ae48dda3cae7","mode":"deterministic","observed_payload_sha256":"03c255b4d39290e8abbfde862613c206ceb1696e6836c3844728efe3d2d67b9e","seed":null},"schema":"mathhead.certificate.v1","subject":{"assumption_sha256s":[],"kind":"goal","obligation_sha256s":[],"problem_ir_sha256":"367b2e835f815491ebd36e73975beadeb5a3ea27594e6aea0a7b536d8eedd43f","reading_id":"reading_only","statement_sha256":"4cf1ba2980979e412ddafd06bb221a80a899d8f245451bc75be04afa55ece236","subject_id":"goal_reflexive","theory_context_sha256":"66625fbb710bf17c0510101146081944975f6d76498c0789a7549c30713c9472"},"trust_dependencies":[{"identifier":"component_checker","kind":"checker_configuration","sha256":"f1d75d2d54572a4ea6ef7d0a3c44e16db3c48468319bc9ff689f9fcb27de1e66"},{"identifier":"MH-C-EXAMPLE-CHECKER-001","kind":"checker_contract","sha256":"0995c19b67f7c09c267750fcfce7cfcde433676f646c414eb627e7c5f79d258c"},{"identifier":"component_checker","kind":"checker_implementation","sha256":"4b7905c1cfb775739c32cadda25f367ab9188230e1c14d7d501e03b3b217c591"},{"identifier":"MH-C-ENV-002","kind":"environment_contract","sha256":"9a7b3269c4fbf66d12a5df2afd09d362d0746fcde26391c917c8cd172ca32506"},{"identifier":"evidence_invalid_certificate","kind":"evidence","sha256":"fc29c96c02ddb719a7b370b179a8956f503c47f0eb971d19bc60ae48dda3cae7"},{"identifier":"ProblemIR","kind":"problem_ir","sha256":"367b2e835f815491ebd36e73975beadeb5a3ea27594e6aea0a7b536d8eedd43f"},{"identifier":"TheoryContext","kind":"theory_context","sha256":"66625fbb710bf17c0510101146081944975f6d76498c0789a7549c30713c9472"}],"verdict":{"checker_result_artifact_id":"artifact_checker_result","diagnostic_ids":["diagnostic_certificate"],"reason":"checker rejected the mathematical claim","reason_code":"semantic_failure","status":"invalid"},"verification_artifacts":[{"artifact_id":"artifact_checker_result","byte_count":150,"extensions":{},"kind":"checker_result","producer_component_id":"component_checker","sha256":"2941bba38a20fc736a40acf76951c143fff82e2f548b1159d51803c0e5fc1ebd"},{"artifact_id":"artifact_replay_log","byte_count":224,"extensions":{},"kind":"replay_log","producer_component_id":"component_checker","sha256":"5469c12c9c8dff675dc89d56224a79b5ea0d3e2adec8e9981108f48aedf92264"}]}
