{"budget":{"final_sha256":"ff363e8072775acfbf43b3eb0ea2b16f7e4eb6da12b2f52fc8e4820cbbc85c9f","initial_sha256":"ff363e8072775acfbf43b3eb0ea2b16f7e4eb6da12b2f52fc8e4820cbbc85c9f","outcome":"completed"},"certificate_id":"certificate_proof","checker":{"component_id":"component_checker","configuration_sha256":"f1d75d2d54572a4ea6ef7d0a3c44e16db3c48468319bc9ff689f9fcb27de1e66","contract_id":"MH-C-EXAMPLE-CHECKER-001","contract_sha256":"0995c19b67f7c09c267750fcfce7cfcde433676f646c414eb627e7c5f79d258c","environment_contract_sha256":"9a7b3269c4fbf66d12a5df2afd09d362d0746fcde26391c917c8cd172ca32506","implementation_sha256":"4b7905c1cfb775739c32cadda25f367ab9188230e1c14d7d501e03b3b217c591","name":"org.mathhead.example-checker","role":"checker","version":"1.0.0"},"diagnostics":[],"evidence":{"dependency_sha256s":[],"evidence_id":"evidence_proof","evidence_sha256":"ac1113e6845d564515576bae565e80c95a155ed54ab31fbbfdd09535072023cf","format_features":[],"format_id":"org.mathhead.proof","format_version":"1.0.0","primary_payload_sha256":"455083c3479b235874a59188d34cb23568a0891a2a23a7fc0fdd607033c444b6","producer":{"component_id":"component_producer","configuration_sha256":"840e05350e0048be566b23028d81590605b88f70844e3e4a428b42d798ac3de8","contract_sha256":"05c4ce74dff8cd9af76d64a936f91450026266cedfaaedb44e8f2b5d98569141","implementation_sha256":"2664ea2ad38cb0501499c85eb6be26069aa09b7835e62a50a4f7b4fb24726f47","role":"solver"},"schema":"mathhead.evidence.v1"},"extensions":{},"format":{"canonicalization":"org.mathhead.canonical-json","features":[],"format_id":"org.mathhead.certificate","major":1,"minor":0,"reader_minimum_minor":0,"schema_sha256":"d711d069d977490a0e85486205b615a49870da271061914a058b9a6d18d0a83b","version":"1.0.0"},"replay":{"algorithm_id":"org.mathhead.fixture.check.proof","attempt_id":"attempt_proof","basis_sha256":"97a50228af468ac74d1218afd449e8826987ab8539c9cbdac9dcaf33651f7493","configuration_sha256":"f1d75d2d54572a4ea6ef7d0a3c44e16db3c48468319bc9ff689f9fcb27de1e66","expected_payload_sha256":"455083c3479b235874a59188d34cb23568a0891a2a23a7fc0fdd607033c444b6","input_evidence_sha256":"ac1113e6845d564515576bae565e80c95a155ed54ab31fbbfdd09535072023cf","mode":"deterministic","observed_payload_sha256":"455083c3479b235874a59188d34cb23568a0891a2a23a7fc0fdd607033c444b6","seed":null},"schema":"mathhead.certificate.v1","subject":{"assumption_sha256s":[],"kind":"goal","obligation_sha256s":[],"problem_ir_sha256":"367b2e835f815491ebd36e73975beadeb5a3ea27594e6aea0a7b536d8eedd43f","reading_id":"reading_only","statement_sha256":"4cf1ba2980979e412ddafd06bb221a80a899d8f245451bc75be04afa55ece236","subject_id":"goal_reflexive","theory_context_sha256":"66625fbb710bf17c0510101146081944975f6d76498c0789a7549c30713c9472"},"trust_dependencies":[{"identifier":"component_checker","kind":"checker_configuration","sha256":"f1d75d2d54572a4ea6ef7d0a3c44e16db3c48468319bc9ff689f9fcb27de1e66"},{"identifier":"MH-C-EXAMPLE-CHECKER-001","kind":"checker_contract","sha256":"0995c19b67f7c09c267750fcfce7cfcde433676f646c414eb627e7c5f79d258c"},{"identifier":"component_checker","kind":"checker_implementation","sha256":"4b7905c1cfb775739c32cadda25f367ab9188230e1c14d7d501e03b3b217c591"},{"identifier":"MH-C-ENV-002","kind":"environment_contract","sha256":"9a7b3269c4fbf66d12a5df2afd09d362d0746fcde26391c917c8cd172ca32506"},{"identifier":"evidence_proof","kind":"evidence","sha256":"ac1113e6845d564515576bae565e80c95a155ed54ab31fbbfdd09535072023cf"},{"identifier":"ProblemIR","kind":"problem_ir","sha256":"367b2e835f815491ebd36e73975beadeb5a3ea27594e6aea0a7b536d8eedd43f"},{"identifier":"TheoryContext","kind":"theory_context","sha256":"66625fbb710bf17c0510101146081944975f6d76498c0789a7549c30713c9472"}],"verdict":{"authority":"checker_attested","checker_result_artifact_id":"artifact_checker_result","diagnostic_ids":[],"status":"verified","supporting_artifact_ids":["artifact_checker_result","artifact_replay_log"]},"verification_artifacts":[{"artifact_id":"artifact_checker_result","byte_count":137,"extensions":{},"kind":"checker_result","producer_component_id":"component_checker","sha256":"87d98ea67a8b5ae8e65784a33b732e2625a39206a2b516da8ad1b13b72e6728d"},{"artifact_id":"artifact_replay_log","byte_count":210,"extensions":{},"kind":"replay_log","producer_component_id":"component_checker","sha256":"a9e234a2f4ae35e65e28ee8bcaf4f44c37834bfc81040d3aa1f6996ea4620901"}]}
